{
  "$schema": "https://json-schema.org/draft/2020-12/schema",
  "$id": "urn:pulseai:schema:report",
  "title": "Report",
  "description": "One daily PulseAI report (report.json). Each item's detail object is validated separately with the schema named by its item type.",
  "type": "object",
  "additionalProperties": false,
  "required": ["schema_version", "meta", "headline", "pulse_score", "kpis", "tldr", "featured", "front_page", "items", "adoption_radar", "action_list", "signals", "corrections", "section_notes", "methodology"],
  "properties": {
    "schema_version": { "const": 1 },
    "meta": { "$ref": "#/$defs/meta" },
    "headline": { "$ref": "#/$defs/shortText" },
    "pulse_score": { "$ref": "#/$defs/pulseScore" },
    "kpis": { "type": "array", "items": { "$ref": "#/$defs/kpi" } },
    "tldr": { "type": "array", "items": { "$ref": "#/$defs/tldrLine" } },
    "featured": { "type": "object", "propertyNames": { "$ref": "#/$defs/id" }, "additionalProperties": { "$ref": "#/$defs/slug" } },
    "front_page": { "type": "array", "items": { "$ref": "#/$defs/visual" } },
    "items": { "type": "array", "items": { "$ref": "#/$defs/item" } },
    "adoption_radar": { "type": "array", "items": { "$ref": "#/$defs/radarEntry" } },
    "action_list": { "type": "array", "items": { "$ref": "#/$defs/action" } },
    "signals": { "type": "array", "items": { "$ref": "#/$defs/item" } },
    "corrections": { "type": "array", "items": { "$ref": "#/$defs/correction" } },
    "section_notes": { "type": "object", "propertyNames": { "$ref": "#/$defs/id" }, "additionalProperties": { "type": "array", "items": { "$ref": "#/$defs/note" } } },
    "methodology": { "$ref": "#/$defs/methodology" }
  },
  "$defs": {
    "id": { "type": "string", "pattern": "^[a-z0-9]+(?:[_-][a-z0-9]+)*$" },
    "slug": { "type": "string", "pattern": "^[a-z0-9]+(?:-[a-z0-9]+)*$", "maxLength": 64 },
    "shortText": { "type": "string", "minLength": 1, "maxLength": 200 },
    "text": { "type": "string", "minLength": 1, "maxLength": 4000 },
    "alt": { "type": "string", "minLength": 1, "maxLength": 500 },
    "httpUrl": { "type": "string", "format": "uri", "pattern": "^https?://" },
    "score": { "type": "integer", "minimum": 1, "maximum": 5 },
    "meta": {
      "title": "ReportMeta",
      "type": "object",
      "additionalProperties": false,
      "required": ["date", "edition", "window", "language", "engine_version", "host", "models", "stats", "cost_usd", "source_health", "sample", "mode"],
      "properties": {
        "date": { "type": "string", "format": "date" },
        "edition": { "type": "integer", "minimum": 1 },
        "window": {
          "title": "ReportWindow",
          "type": "object",
          "additionalProperties": false,
          "required": ["start", "end", "tz"],
          "properties": {
            "start": { "type": "string", "format": "date-time" },
            "end": { "type": "string", "format": "date-time" },
            "tz": { "type": "string", "minLength": 1 }
          }
        },
        "language": { "type": "string", "pattern": "^[a-z]{2,3}(-[A-Z]{2})?$" },
        "engine_version": { "type": "string", "minLength": 1 },
        "host": { "enum": ["routine", "actions", "local", "fixture"] },
        "models": { "type": "object", "propertyNames": { "$ref": "#/$defs/id" }, "additionalProperties": { "type": "string", "minLength": 1 } },
        "stats": {
          "title": "RunStats",
          "type": "object",
          "additionalProperties": false,
          "required": ["scanned", "triaged", "verified", "published"],
          "properties": {
            "scanned": { "type": "integer", "minimum": 0 },
            "triaged": { "type": "integer", "minimum": 0 },
            "verified": { "type": "integer", "minimum": 0 },
            "published": { "type": "integer", "minimum": 0 }
          }
        },
        "cost_usd": { "type": ["number", "null"], "minimum": 0 },
        "source_health": {
          "type": "array",
          "items": {
            "title": "SourceHealth",
            "type": "object",
            "additionalProperties": false,
            "required": ["source_id", "ok", "items"],
            "properties": {
              "source_id": { "$ref": "#/$defs/id" },
              "ok": { "type": "boolean" },
              "items": { "type": "integer", "minimum": 0 },
              "error": { "type": "string", "minLength": 1 }
            }
          }
        },
        "sample": { "type": "boolean" },
        "mode": { "enum": ["normal", "plain", "catch_up"] }
      }
    },
    "pulseScore": {
      "title": "PulseScore",
      "type": "object",
      "additionalProperties": false,
      "required": ["value", "avg_7d"],
      "properties": {
        "value": { "type": "integer", "minimum": 0 },
        "avg_7d": { "type": ["number", "null"], "minimum": 0 }
      }
    },
    "kpi": {
      "title": "Kpi",
      "type": "object",
      "additionalProperties": false,
      "required": ["label", "value"],
      "properties": {
        "label": { "$ref": "#/$defs/shortText" },
        "value": { "type": ["string", "number"] },
        "delta": { "type": "number" },
        "series": { "type": "array", "items": { "type": "number" } }
      }
    },
    "tldrLine": {
      "title": "TldrLine",
      "type": "object",
      "additionalProperties": false,
      "required": ["text", "item_id"],
      "properties": { "text": { "$ref": "#/$defs/shortText" }, "item_id": { "$ref": "#/$defs/slug" } }
    },
    "radarEntry": {
      "title": "RadarEntry",
      "type": "object",
      "additionalProperties": false,
      "required": ["item_id", "ring", "rationale"],
      "properties": {
        "item_id": { "$ref": "#/$defs/slug" },
        "ring": { "enum": ["adopt", "trial", "assess", "hold"] },
        "rationale": { "$ref": "#/$defs/text" }
      }
    },
    "action": {
      "title": "ActionItem",
      "type": "object",
      "additionalProperties": false,
      "required": ["text"],
      "properties": { "text": { "$ref": "#/$defs/shortText" }, "item_id": { "$ref": "#/$defs/slug" } }
    },
    "correction": {
      "title": "Correction",
      "type": "object",
      "additionalProperties": false,
      "required": ["report_date", "item_id", "text"],
      "properties": {
        "report_date": { "type": "string", "format": "date" },
        "item_id": { "$ref": "#/$defs/slug" },
        "text": { "$ref": "#/$defs/text" }
      }
    },
    "note": {
      "title": "SectionNote",
      "type": "object",
      "additionalProperties": false,
      "required": ["title", "text"],
      "properties": {
        "group": { "$ref": "#/$defs/id" },
        "title": { "$ref": "#/$defs/shortText" },
        "text": { "$ref": "#/$defs/text" },
        "url": { "$ref": "#/$defs/httpUrl" }
      }
    },
    "methodology": {
      "title": "Methodology",
      "type": "object",
      "additionalProperties": false,
      "required": ["notes", "rejected"],
      "properties": {
        "notes": { "type": "array", "items": { "$ref": "#/$defs/text" } },
        "rejected": {
          "type": "array",
          "items": {
            "title": "RejectedItem",
            "type": "object",
            "additionalProperties": false,
            "required": ["title", "reason"],
            "properties": {
              "title": { "$ref": "#/$defs/shortText" },
              "reason": { "$ref": "#/$defs/shortText" },
              "url": { "$ref": "#/$defs/httpUrl" }
            }
          }
        }
      }
    },
    "source": {
      "title": "ItemSource",
      "type": "object",
      "additionalProperties": false,
      "required": ["url", "title", "tier", "kind"],
      "properties": {
        "url": { "$ref": "#/$defs/httpUrl" },
        "title": { "$ref": "#/$defs/shortText" },
        "tier": { "enum": ["T1", "T1-data", "T2", "T3"] },
        "kind": { "enum": ["primary", "secondary"] },
        "fetched_at": { "type": "string", "format": "date-time" }
      }
    },
    "fact": {
      "title": "ItemFact",
      "type": "object",
      "additionalProperties": false,
      "required": ["label", "value", "source_ref", "quote"],
      "properties": {
        "label": { "$ref": "#/$defs/shortText" },
        "value": { "type": ["string", "number"] },
        "unit": { "type": "string", "minLength": 1, "maxLength": 20 },
        "source_ref": { "type": "integer", "minimum": 0 },
        "quote": { "type": "string", "minLength": 1, "maxLength": 400 }
      }
    },
    "image": {
      "title": "ItemImage",
      "type": "object",
      "additionalProperties": false,
      "required": ["url", "caption", "credit", "alt"],
      "properties": {
        "url": { "$ref": "#/$defs/httpUrl" },
        "caption": { "$ref": "#/$defs/shortText" },
        "credit": { "$ref": "#/$defs/shortText" },
        "alt": { "$ref": "#/$defs/alt" },
        "license": { "type": "string", "minLength": 1 }
      }
    },
    "visual": {
      "oneOf": [
        { "$ref": "#/$defs/vegaLiteVisual" },
        { "$ref": "#/$defs/mermaidVisual" },
        { "$ref": "#/$defs/tableVisual" },
        { "$ref": "#/$defs/imageRefVisual" }
      ]
    },
    "vegaLiteVisual": {
      "title": "VegaLiteVisual",
      "type": "object",
      "additionalProperties": false,
      "required": ["kind", "id", "title", "alt", "source_note", "spec"],
      "properties": {
        "kind": { "const": "vega-lite" },
        "id": { "$ref": "#/$defs/slug" },
        "title": { "$ref": "#/$defs/shortText" },
        "alt": { "$ref": "#/$defs/alt" },
        "source_note": { "$ref": "#/$defs/shortText" },
        "spec": { "type": "object", "minProperties": 1 }
      }
    },
    "mermaidVisual": {
      "title": "MermaidVisual",
      "type": "object",
      "additionalProperties": false,
      "required": ["kind", "id", "title", "alt", "source_note", "code"],
      "properties": {
        "kind": { "const": "mermaid" },
        "id": { "$ref": "#/$defs/slug" },
        "title": { "$ref": "#/$defs/shortText" },
        "alt": { "$ref": "#/$defs/alt" },
        "source_note": { "$ref": "#/$defs/shortText" },
        "code": { "type": "string", "minLength": 1, "maxLength": 20000 }
      }
    },
    "tableVisual": {
      "title": "TableVisual",
      "type": "object",
      "additionalProperties": false,
      "required": ["kind", "id", "title", "alt", "source_note", "columns", "rows"],
      "properties": {
        "kind": { "const": "table" },
        "id": { "$ref": "#/$defs/slug" },
        "title": { "$ref": "#/$defs/shortText" },
        "alt": { "$ref": "#/$defs/alt" },
        "source_note": { "$ref": "#/$defs/shortText" },
        "columns": { "type": "array", "minItems": 1, "items": { "$ref": "#/$defs/shortText" } },
        "rows": { "type": "array", "items": { "type": "array", "items": { "type": ["string", "number", "boolean", "null"] } } }
      }
    },
    "imageRefVisual": {
      "title": "ImageRefVisual",
      "type": "object",
      "additionalProperties": false,
      "required": ["kind", "id", "title", "alt", "source_note", "image"],
      "properties": {
        "kind": { "const": "image-ref" },
        "id": { "$ref": "#/$defs/slug" },
        "title": { "$ref": "#/$defs/shortText" },
        "alt": { "$ref": "#/$defs/alt" },
        "source_note": { "$ref": "#/$defs/shortText" },
        "image": { "$ref": "#/$defs/image" }
      }
    },
    "item": {
      "title": "Item",
      "type": "object",
      "additionalProperties": false,
      "required": ["id", "section", "type", "title", "entity_key", "impact", "novelty", "relevance", "confidence", "summary", "why_it_matters", "sources", "facts", "visuals", "images", "detail"],
      "properties": {
        "id": { "$ref": "#/$defs/slug" },
        "section": { "$ref": "#/$defs/id" },
        "type": { "$ref": "#/$defs/id" },
        "title": { "$ref": "#/$defs/shortText" },
        "entity_key": { "type": "string", "minLength": 1, "maxLength": 200 },
        "thread_id": { "$ref": "#/$defs/slug" },
        "update_of": { "type": "string", "pattern": "^\\d{4}-\\d{2}-\\d{2}#[a-z0-9]+(?:-[a-z0-9]+)*$" },
        "impact": { "$ref": "#/$defs/score" },
        "novelty": { "$ref": "#/$defs/score" },
        "relevance": { "$ref": "#/$defs/score" },
        "confidence": { "enum": ["confirmed", "reported", "rumor"] },
        "summary": { "$ref": "#/$defs/text" },
        "why_it_matters": { "$ref": "#/$defs/text" },
        "what_to_do": { "$ref": "#/$defs/text" },
        "caveats": { "$ref": "#/$defs/text" },
        "sources": { "type": "array", "minItems": 1, "items": { "$ref": "#/$defs/source" } },
        "facts": { "type": "array", "items": { "$ref": "#/$defs/fact" } },
        "visuals": { "type": "array", "items": { "$ref": "#/$defs/visual" } },
        "images": { "type": "array", "items": { "$ref": "#/$defs/image" } },
        "detail": { "type": "object" }
      }
    }
  }
}
